{
  "schema_version": "1.0.0",
  "provider_id": "provider:user-built",
  "artifact_digest": "aaaaaaaaaaaaaaaaaaaaaaaaaaaaaaaaaaaaaaaaaaaaaaaaaaaaaaaaaaaaaaaa",
  "live_checks_evidence_digest": "bbbbbbbbbbbbbbbbbbbbbbbbbbbbbbbbbbbbbbbbbbbbbbbbbbbbbbbbbbbbbbbb",
  "live_checks_expires_at": "2026-07-26T12:09:00Z",
  "stage": "final_confirmation_recorded",
  "confirmed_by": "user-1",
  "confirmed_at": "2026-07-26T12:05:00Z",
  "action": "Yes, Print",
  "click_number": 4,
  "requires_controlled_upload": true,
  "physical_dispatch_allowed": false
}
